{"type":"object","properties":{"navigationBarBackgroundColor":{"type":"string"},"navigationBarTextStyle":{"enum":["black","white"],"type":"string"},"navigationBarTitleText":{"type":"string"},"navigationStyle":{"enum":["custom","default"],"type":"string"},"backgroundColor":{"type":"string"},"backgroundTextStyle":{"enum":["dark","light"],"type":"string"},"enablePullDownRefresh":{"type":"boolean"},"onReachBottomDistance":{"type":"number"},"disableScroll":{"type":"boolean"},"disableSwipeBack":{"type":"boolean"},"backgroundColorTop":{"type":"string"},"backgroundColorBottom":{"type":"string"},"usingComponents":{"type":"object","additionalProperties":{"type":"string"}},"pageOrientation":{"enum":["auto","landscape","portrait"],"type":"string"},"restartStrategy":{"enum":["homePage","homePageAndLatestPage"],"type":"string"},"component":{"type":"boolean"},"componentGenerics":{"type":"object","additionalProperties":{"anyOf":[{"type":"object","additionalProperties":{"type":"string"}},{"type":"boolean"}]}},"singlePage":{"type":"object","properties":{"navigationBarFit":{"enum":["float","squeezed"],"type":"string"}},"additionalProperties":false},"pageJSONLight":{"$ref":"#/definitions/IOriginalPageJSON"},"pageJSONDark":{"$ref":"#/definitions/IOriginalPageJSON"}},"additionalProperties":false,"definitions":{"IOriginalPageJSON":{"type":"object","properties":{"navigationBarBackgroundColor":{"type":"string"},"navigationBarTextStyle":{"enum":["black","white"],"type":"string"},"navigationBarTitleText":{"type":"string"},"navigationStyle":{"enum":["custom","default"],"type":"string"},"backgroundColor":{"type":"string"},"backgroundTextStyle":{"enum":["dark","light"],"type":"string"},"enablePullDownRefresh":{"type":"boolean"},"onReachBottomDistance":{"type":"number"},"disableScroll":{"type":"boolean"},"disableSwipeBack":{"type":"boolean"},"backgroundColorTop":{"type":"string"},"backgroundColorBottom":{"type":"string"},"usingComponents":{"type":"object","additionalProperties":{"type":"string"}},"pageOrientation":{"enum":["auto","landscape","portrait"],"type":"string"},"restartStrategy":{"enum":["homePage","homePageAndLatestPage"],"type":"string"},"component":{"type":"boolean"},"componentGenerics":{"type":"object","additionalProperties":{"anyOf":[{"type":"object","additionalProperties":{"type":"string"}},{"type":"boolean"}]}},"singlePage":{"type":"object","properties":{"navigationBarFit":{"enum":["float","squeezed"],"type":"string"}},"additionalProperties":false}},"additionalProperties":false}},"$schema":"http://json-schema.org/draft-07/schema#","$version":1587371684236}