{
  "usingComponents": {
    "i-drawer": "/src/ui/iviewui/dist/drawer/index",
    "i-tab-bar": "/src/ui/iviewui/dist/tab-bar/index",
    "i-tab-bar-item": "/src/ui/iviewui/dist/tab-bar-item/index",
    "i-notice-bar": "/src/ui/iviewui/dist/notice-bar/index",
    "i-button": "/src/ui/iviewui/dist/button/index",
    "i-spin": "/src/ui/iviewui/dist/spin/index",
    "markdown": "/wx-markdown/component/index",
    "wemark": "/wemark/wemark"
  },
  "enablePullDownRefresh": true,
  "backgroundColor": "#36a1f0",
  "navigationStyle": "custom"
}
