{
  "usingComponents": {
    "i-drawer": "/iviewui/dist/drawer/index",
    "i-tab-bar": "/iviewui/dist/tab-bar/index",
    "i-tab-bar-item": "/iviewui/dist/tab-bar-item/index",
    "i-notice-bar": "/iviewui/dist/notice-bar/index",
    "i-button": "/iviewui/dist/button/index",
    "i-spin": "/iviewui/dist/spin/index"
  },
  "enablePullDownRefresh": true,
  "backgroundColor": "#36a1f0",
  "navigationStyle": "custom"
}
