{
  "usingComponents": {
    "i-cell-group": "/src/ui/iviewui/dist/cell-group/index",
    "i-cell": "/src/ui/iviewui/dist/cell/index",
    "i-switch": "/src/ui/iviewui/dist/switch/index",
    "i-panel": "/src/ui/iviewui/dist/panel/index",
    "i-rate": "/src/ui/iviewui/dist/rate/index"
  },
  "navigationStyle": "default",
  "enablePullDownRefresh": true,
  "backgroundTextStyle": "light",
  "backgroundColor": "@bgColor"
}
